{
  "round": 1,
  "branch_id": "b001",
  "hypothesis": "v1.5 can prepare portable codex exec worker artifacts and import schema-backed results into the same exploration ledger.",
  "probe": "Inspect generated worker artifacts and import this schema-valid mock result.",
  "actions": [
    {
      "kind": "shell",
      "summary": "prepare-worker --portable",
      "result": "Generated prompt, PowerShell runner, copied schema, and portable worker manifest."
    },
    {
      "kind": "test",
      "summary": "mock schema result import",
      "result": "Used finish-worker to validate and append the worker result."
    }
  ],
  "network_used": false,
  "skills_used": [
    "codex-exploration-loop"
  ],
  "subagents_used": [],
  "files_touched": [
    "experiments/2026-06-24-codex-exploration-loop-v1-5-smoke/artifacts/b001-round-001.prompt.md",
    "experiments/2026-06-24-codex-exploration-loop-v1-5-smoke/artifacts/b001-round-001.codex-exec.ps1",
    "experiments/2026-06-24-codex-exploration-loop-v1-5-smoke/artifacts/b001-round-001.worker.json",
    "experiments/2026-06-24-codex-exploration-loop-v1-5-smoke/artifacts/b001-round-001.schema.json"
  ],
  "evidence": [
    {
      "path_or_url": "experiments/2026-06-24-codex-exploration-loop-v1-5-smoke/artifacts/b001-round-001.worker.json",
      "supports": "The worker manifest stores relative artifact names in portable mode.",
      "confidence": "high"
    },
    {
      "path_or_url": "experiments/2026-06-24-codex-exploration-loop-v1-5-smoke/artifacts/b001-round-001.codex-exec.ps1",
      "supports": "The generated runner uses the official codex exec CLI with --output-schema, --output-last-message, and --json.",
      "confidence": "high"
    }
  ],
  "scores": {
    "novelty": 3,
    "promise": 4,
    "evidence": 4,
    "risk": 1,
    "cost": 1
  },
  "reflection": "The v1.5 adapter closes the gap between manual ledger rounds and official codex exec workers while keeping public artifacts portable.",
  "decision": "promote",
  "next_probe": "Forward-test one real codex exec worker in a disposable scratch workspace when model/runtime cost is acceptable."
}
